{
  "meta": {
    "slug": "envejecimiento",
    "titulo": "El rápido envejecimiento poblacional y la diáspora en Cuba",
    "subtitulo": "Cómo el éxodo migratorio deformó la pirámide poblacional cubana, comparado con un escenario sin él",
    "descripcion": "Cuba atraviesa la crisis demográfica más aguda de América Latina: envejecimiento acelerado, natalidad en mínimos históricos y un éxodo migratorio que golpea, sobre todo, a la población en edad laboral y reproductiva. Según la Oficina Nacional de Estadísticas e Información (ONEI), la población residente cayó a 9.748.532 habitantes a finales de 2024, y a un estimado de alrededor de 9,4 millones hacia finales de 2025: un descenso sostenido por cuarto año consecutivo. El demógrafo independiente Juan Carlos Albizu-Campos sitúa la población efectiva muy por debajo de esa cifra oficial: 8,62 millones en 2023 y 8,025 millones en 2024, una divergencia de método (población de derecho frente a población efectivamente presente en la isla) que conviene no leer como un error, sino como dos formas distintas de contar.\n\nEl motor central es la emigración. Desde octubre de 2021, más de 850.000 cubanos han llegado a Estados Unidos según datos de la Oficina de Aduanas y Protección Fronteriza (CBP), con picos entre 2022 y 2023; sumando otros destinos, el total migratorio ronda o supera el millón, aunque no existe una fuente única que consolide esa cifra global con precisión. Las mujeres representan entre el 56% y el 57% de quienes emigran, y buena parte del éxodo se concentra en población en edad laboral y reproductiva, lo que erosiona a la vez la base de nacimientos y la fuerza de trabajo activa.\n\nEl resultado es una pirámide poblacional que se invierte con rapidez. El grupo de 60 años o más alcanzó el 25,7% de la población en 2024 (frente al 19,4% de 2015), la proporción más alta de América Latina y el Caribe, y la mediana de edad llegó a 42,2 años. En paralelo, la natalidad se desploma: 2025 cerró con 68.051 nacimientos frente a 134.354 defunciones —casi el doble—, un saldo natural negativo superior a 66.000 personas y una tasa de fecundidad de 1,45 hijos por mujer, muy por debajo del nivel de reemplazo (2,1). Naciones Unidas proyecta que, de continuar la tendencia, la población cubana podría rondar los 5,6 millones hacia el año 2100; para 2050 las proyecciones son más dispersas, entre 7 y 9,4 millones según la fuente, con el grupo de 60 años o más acercándose a un tercio de la población.\n\nEsta transformación golpea directamente a dos sistemas: pensiones y salud. La pensión mínima, elevada a 4.000 pesos cubanos (CUP) desde septiembre de 2025, equivale a entre 7 y 10 dólares al cambio informal, frente a una canasta de bienes y servicios de referencia que estudios académicos sitúan entre 50.000 y 96.000 CUP mensuales por persona. Una encuesta de la Asociación Sindical Independiente de Cuba (ASIC, 506 personas, no representativa a escala nacional) encontró que el 99% de sus encuestados no cubre con su pensión ni alimentación, ni vivienda ni medicamentos. En salud, más de 77.000 profesionales emigraron entre 2021 y 2024, y la cantidad de médicos cayó cerca de un 30%, de 104 a 131 habitantes por médico.\n\nEl expediente incluye también un ejercicio contrafactual explícitamente hipotético: cómo luciría la pirámide poblacional sin el éxodo migratorio posterior a 2021. No es una proyección demográfica oficial ni una medición, sino una forma de dimensionar cuánto de la crisis actual es tendencia de fondo (baja fecundidad desde los años setenta) y cuánto es aceleración por la salida masiva y reciente de población joven.",
    "narracion": "Cuba envejece más rápido que ningún otro país de América Latina, mientras se vacía de gente joven. La población oficial cayó a nueve millones setecientos cuarenta y ocho mil habitantes a finales de dos mil veinticuatro, y ronda los nueve millones cuatrocientos mil hacia finales de dos mil veinticinco. Un demógrafo independiente calcula una cifra aún menor: ocho millones de habitantes en dos mil veinticuatro.\n\nEl motor es la emigración: desde dos mil veintiuno, más de ochocientos cincuenta mil cubanos llegaron a Estados Unidos, y más de la mitad de quienes emigran son mujeres. Se van, sobre todo, los más jóvenes y quienes están en edad de trabajar y de tener hijos.\n\nEl resultado: uno de cada cuatro cubanos tiene sesenta años o más, la proporción más alta de la región. La edad mediana llega a cuarenta y dos años. Nacen menos de setenta mil niños al año, frente a más de ciento treinta y cuatro mil muertes: casi el doble.\n\nNaciones Unidas proyecta que Cuba podría tener solo cinco millones seiscientos mil habitantes hacia el año dos mil cien.\n\nLa pensión mínima cubre apenas una fracción de la canasta básica real, y más de setenta y siete mil profesionales de salud emigraron en cuatro años. Este expediente muestra, con datos verificados, cómo se deforma la pirámide poblacional cubana, y la compara con un escenario hipotético: el que existiría sin el éxodo masivo de la última década.",
    "fecha_publicacion": "2026-07-19",
    "fuentes": [
      "ONEI (Oficina Nacional de Estadísticas e Información) — Anuario Demográfico y notas oficiales",
      "Oficina de Aduanas y Protección Fronteriza de EE. UU. (CBP)",
      "Naciones Unidas — División de Población (World Population Prospects)",
      "Juan Carlos Albizu-Campos (demógrafo independiente), citado por 14ymedio, Martí Noticias y Diario de Cuba",
      "Asociación Sindical Independiente de Cuba (ASIC)",
      "Prensa independiente y agencias: Infobae, El País, CubaConecta, elTOQUE, CiberCuba"
    ],
    "sistema_confianza": {
      "confirmado": "Cifra oficial o de fuente primaria (ONEI, CBP, ONU) cotejada directamente.",
      "reportado": "Ampliamente citada por prensa independiente o estudios académicos, sin una única fuente primaria consolidada.",
      "estimado": "Proyección, extrapolación o cálculo ilustrativo; no es una medición."
    },
    "notas_metodologicas": [
      "La cifra de 'canasta básica' de 12.000 CUP mencionada en el envío original subestima gravemente el coste real: estudios académicos la sitúan entre 50.000 y 96.000 CUP/mes; este expediente usa esos valores.",
      "El hallazgo de que el 99% de los jubilados no cubre sus necesidades básicas proviene de una encuesta de la ASIC con 506 respuestas: no es representativa a escala nacional y se presenta siempre con esa salvedad.",
      "La 'mediana de edad más alta' de Cuba se acota a América Latina y el Caribe: no se pudo verificar la comparación con el conjunto de las Américas (incluidos EE. UU., Canadá y Puerto Rico).",
      "El escenario 'sin el éxodo masivo post-2021' es un ejercicio contrafactual hipotético, no una medición ni una proyección oficial: ilustra magnitud, no certeza.",
      "La pirámide de edades se construye como modelo ilustrativo, calibrado sobre los porcentajes de población de 60 años o más y la mediana de edad verificados por ONEI; no reproduce el detalle quinquenal exacto del anuario demográfico.",
      "La escasez del 70% de medicamentos esenciales es una cifra ampliamente repetida en el discurso público, pero no se localizó una fuente primaria que la sustente en esta verificación; se marca como estimada."
    ],
    "tesis_confianza": [
      {
        "afirmacion": "Población residente cayó a 9.748.532 a finales de 2024 (ONEI)",
        "nivel": "confirmado"
      },
      {
        "afirmacion": "Estimación independiente de Albizu-Campos: 8,025 millones en 2024",
        "nivel": "reportado"
      },
      {
        "afirmacion": "60 años o más = 25,7% de la población en 2024, la más alta de América Latina y el Caribe",
        "nivel": "confirmado"
      },
      {
        "afirmacion": "68.051 nacimientos y 134.354 defunciones en 2025 (saldo -66.303)",
        "nivel": "confirmado"
      },
      {
        "afirmacion": "Proyección ONU de ~5,6 millones de habitantes hacia 2100",
        "nivel": "confirmado"
      },
      {
        "afirmacion": "Proyección de 30-36% de personas de 60+ hacia 2050 y población de 7-9,4 millones",
        "nivel": "estimado"
      },
      {
        "afirmacion": "Escasez del 70% de medicamentos esenciales",
        "nivel": "estimado"
      },
      {
        "afirmacion": "Escenario contrafactual sin éxodo post-2021 (10,5-11 millones en 2025-26)",
        "nivel": "estimado"
      }
    ]
  },
  "piramide": {
    "advertencia": "Modelo ilustrativo calibrado sobre los porcentajes de personas de 60 años o más y la mediana de edad verificados por ONEI; no reproduce el detalle quinquenal exacto del anuario demográfico.",
    "escenarios": [
      {
        "id": "real",
        "nombre": "Trayectoria observada",
        "anclas": [
          {
            "anio": 2025,
            "confianza": "confirmado",
            "nota": "Cifra ONEI de cierre de 2024 (9.748.532), usada como año base del modelo.",
            "poblacion_total": 9748532,
            "pct_60_mas": 25.7,
            "mediana_edad": 42.2,
            "grupos": [
              {
                "edad": "0-9",
                "hombres": 5.61,
                "mujeres": 5.39
              },
              {
                "edad": "10-19",
                "hombres": 6.38,
                "mujeres": 6.12
              },
              {
                "edad": "20-29",
                "hombres": 6.5,
                "mujeres": 6.5
              },
              {
                "edad": "30-39",
                "hombres": 7.44,
                "mujeres": 8.06
              },
              {
                "edad": "40-49",
                "hombres": 6.0,
                "mujeres": 6.5
              },
              {
                "edad": "50-59",
                "hombres": 4.61,
                "mujeres": 5.19
              },
              {
                "edad": "60-69",
                "hombres": 6.3,
                "mujeres": 7.7
              },
              {